{"aircraft_id":"tello-canningst","battery":{"landing_floor_percent":20.0,"margin_percent_per_s":0.02,"quantization_allowance_percent":1.0,"worst_observed_percent_per_s":0.3086566211938009},"camera_sha256":null,"firmware_version":null,"holdout_run_ids":[],"kind":"flight","pose_envelope":[{"distance_cm":40.0,"drift_cm":6.9,"time_s":9.0,"yaw_deg":0.0},{"distance_cm":50.0,"drift_cm":7.8,"time_s":7.0,"yaw_deg":0.0},{"distance_cm":85.0,"drift_cm":10.3,"time_s":12.5,"yaw_deg":0.0},{"distance_cm":90.0,"drift_cm":10.4,"time_s":11.5,"yaw_deg":0.0},{"distance_cm":95.0,"drift_cm":1.2,"time_s":19.0,"yaw_deg":0.0},{"distance_cm":110.0,"drift_cm":16.2,"time_s":20.5,"yaw_deg":0.0},{"distance_cm":140.0,"drift_cm":35.2,"time_s":24.5,"yaw_deg":0.0},{"distance_cm":145.0,"drift_cm":8.2,"time_s":19.0,"yaw_deg":0.0},{"distance_cm":145.0,"drift_cm":25.0,"time_s":24.0,"yaw_deg":0.0},{"distance_cm":150.0,"drift_cm":55.9,"time_s":25.0,"yaw_deg":0.0}],"profile_sha256":"5f74b5223efb9e5288b3f09548ad4971b6cb5c2f3bb8895e296a792becea6e6f","schema_version":"room-calibration-profile-v1","site_sha256":"0770fca67cdbf6d94ec8e65b6586196d260f962a7dee2f3f126d9935662d83b2","speeds_cm_s":[20,50],"state":"CALIBRATION","tag_map_sha256":"b78f12620ee0e6df80c3b3e740c7d22b4d4c9ed1c65df78ec9c42558c885f80a","training_run_ids":["20260922-095022-reanchor","20260922-163134-reanchor","20260923-122157-reanchor","20260923-134358-reanchor"]}